{
  "irVersion": "1.6",
  "source": {
    "project": "01920000-0000-7000-8000-00000000c0b1",
    "ref": "v0.0.1",
    "immutable": true,
    "schemaHash": "sha256:71b7fd997397b6f7c15f6dff7d579d6679a395e8dc66f6ed0b19b7c38b302743"
  },
  "types": {
    "article": {
      "slug": "article",
      "name": "Article",
      "version": "01920000-0000-7000-8000-0000000000b1",
      "fields": [
        {
          "id": "title",
          "name": "title",
          "kind": "text",
          "presence": "maybe",
          "required": false,
          "localized": true,
          "sortable": false
        },
        {
          "id": "body",
          "name": "body",
          "kind": "longText",
          "presence": "maybe",
          "required": false,
          "localized": false,
          "sortable": false,
          "textFormat": "plain"
        },
        {
          "id": "rank",
          "name": "rank",
          "kind": "integer",
          "presence": "maybe",
          "required": false,
          "localized": false,
          "sortable": true
        },
        {
          "id": "related",
          "name": "related",
          "kind": "reference",
          "presence": "maybe",
          "required": false,
          "localized": false,
          "sortable": false,
          "many": true,
          "of": [
            "article"
          ]
        }
      ]
    },
    "figure": {
      "slug": "figure",
      "name": "Figure",
      "version": "01920000-0000-7000-8000-0000000000b3",
      "fields": [
        {
          "id": "caption",
          "name": "caption",
          "kind": "text",
          "presence": "maybe",
          "required": false,
          "localized": false,
          "sortable": false
        },
        {
          "id": "image",
          "name": "image",
          "kind": "asset",
          "presence": "maybe",
          "required": false,
          "localized": false,
          "sortable": false,
          "many": false,
          "accept": [
            "image/*"
          ]
        },
        {
          "id": "poster",
          "name": "poster",
          "kind": "asset",
          "presence": "maybe",
          "required": false,
          "localized": false,
          "sortable": false,
          "many": false,
          "accept": []
        },
        {
          "id": "gallery",
          "name": "gallery",
          "kind": "asset",
          "presence": "maybe",
          "required": false,
          "localized": false,
          "sortable": false,
          "many": true,
          "accept": []
        },
        {
          "id": "sources",
          "name": "sources",
          "kind": "repeater",
          "presence": "maybe",
          "required": false,
          "localized": false,
          "sortable": false,
          "of": [
            "citation"
          ]
        },
        {
          "id": "steps",
          "name": "steps",
          "kind": "repeater",
          "presence": "maybe",
          "required": false,
          "localized": false,
          "sortable": false,
          "of": [
            "step"
          ]
        },
        {
          "id": "keywords",
          "name": "keywords",
          "kind": "list",
          "item": "text",
          "presence": "maybe",
          "required": false,
          "localized": true,
          "sortable": false
        },
        {
          "id": "sizes",
          "name": "sizes",
          "kind": "list",
          "item": "integer",
          "presence": "maybe",
          "required": false,
          "localized": false,
          "sortable": false,
          "max": 5
        }
      ]
    },
    "notice": {
      "slug": "notice",
      "name": "Notice",
      "version": "01920000-0000-7000-8000-0000000000b2",
      "fields": [
        {
          "id": "priority",
          "name": "priority",
          "kind": "integer",
          "presence": "maybe",
          "required": false,
          "localized": false,
          "sortable": true
        },
        {
          "id": "message",
          "name": "message",
          "kind": "text",
          "presence": "maybe",
          "required": false,
          "localized": false,
          "sortable": false
        }
      ]
    },
    "outline": {
      "slug": "outline",
      "name": "Outline",
      "version": "01920000-0000-7000-8000-0000000000bb",
      "fields": [
        {
          "id": "sections",
          "name": "sections",
          "kind": "repeater",
          "presence": "maybe",
          "required": false,
          "localized": false,
          "sortable": false,
          "of": [
            "outlineSection"
          ]
        }
      ]
    }
  },
  "components": {
    "citation": {
      "slug": "citation",
      "name": "Citation",
      "version": "01920000-0000-7000-8000-0000000000b9",
      "fields": [
        {
          "id": "authors",
          "name": "authors",
          "kind": "text",
          "presence": "always",
          "required": true,
          "localized": false,
          "sortable": false
        },
        {
          "id": "year",
          "name": "year",
          "kind": "integer",
          "presence": "always",
          "required": true,
          "localized": false,
          "sortable": false
        },
        {
          "id": "title",
          "name": "title",
          "kind": "text",
          "presence": "always",
          "required": true,
          "localized": false,
          "sortable": false
        },
        {
          "id": "url",
          "name": "url",
          "kind": "text",
          "presence": "maybe",
          "required": false,
          "localized": false,
          "sortable": false
        }
      ]
    },
    "note": {
      "slug": "note",
      "name": "Note",
      "version": "01920000-0000-7000-8000-0000000000be",
      "fields": [
        {
          "id": "text",
          "name": "text",
          "kind": "text",
          "presence": "maybe",
          "required": false,
          "localized": false,
          "sortable": false
        }
      ]
    },
    "outlineSection": {
      "slug": "outlineSection",
      "name": "Outline section",
      "version": "01920000-0000-7000-8000-0000000000bc",
      "fields": [
        {
          "id": "heading",
          "name": "heading",
          "kind": "text",
          "presence": "maybe",
          "required": false,
          "localized": true,
          "sortable": false
        },
        {
          "id": "points",
          "name": "points",
          "kind": "repeater",
          "presence": "maybe",
          "required": false,
          "localized": false,
          "sortable": false,
          "of": [
            "point"
          ]
        },
        {
          "id": "notes",
          "name": "notes",
          "kind": "repeater",
          "presence": "maybe",
          "required": false,
          "localized": true,
          "sortable": false,
          "of": [
            "note"
          ]
        }
      ]
    },
    "point": {
      "slug": "point",
      "name": "Point",
      "version": "01920000-0000-7000-8000-0000000000bd",
      "fields": [
        {
          "id": "text",
          "name": "text",
          "kind": "text",
          "presence": "maybe",
          "required": false,
          "localized": true,
          "sortable": false
        },
        {
          "id": "children",
          "name": "children",
          "kind": "repeater",
          "presence": "maybe",
          "required": false,
          "localized": false,
          "sortable": false,
          "of": [
            "point"
          ]
        }
      ]
    },
    "step": {
      "slug": "step",
      "name": "Step",
      "version": "01920000-0000-7000-8000-0000000000ba",
      "fields": [
        {
          "id": "label",
          "name": "label",
          "kind": "text",
          "presence": "maybe",
          "required": false,
          "localized": true,
          "sortable": false
        },
        {
          "id": "minutes",
          "name": "minutes",
          "kind": "integer",
          "presence": "maybe",
          "required": false,
          "localized": false,
          "sortable": false
        }
      ]
    }
  }
}
