{
  "irVersion": "1.6",
  "source": {
    "project": "01920000-0000-7000-8000-00000000c0b2",
    "ref": "v0.0.1",
    "immutable": true,
    "schemaHash": "sha256:8444ac344c6d6fb5d9c0abfce116f1eb6bbabb6a27163ad10ba1e995e621c09d"
  },
  "types": {
    "page": {
      "slug": "page",
      "name": "Page",
      "version": "01920000-0000-7000-8000-0000000000c1",
      "fields": [
        {
          "id": "title",
          "name": "title",
          "kind": "text",
          "presence": "always",
          "required": true,
          "localized": false,
          "sortable": false
        },
        {
          "id": "hero",
          "name": "hero",
          "kind": "asset",
          "presence": "always",
          "required": true,
          "localized": false,
          "sortable": false,
          "many": false,
          "accept": [
            "image/*"
          ]
        },
        {
          "id": "thumbnail",
          "name": "thumbnail",
          "kind": "asset",
          "presence": "maybe",
          "required": false,
          "localized": false,
          "sortable": false,
          "many": false,
          "accept": [
            "image/png",
            "image/webp"
          ]
        },
        {
          "id": "gallery",
          "name": "gallery",
          "kind": "asset",
          "presence": "maybe",
          "required": false,
          "localized": false,
          "sortable": false,
          "many": true,
          "accept": [
            "image/jpeg",
            "image/webp"
          ],
          "max": 12
        },
        {
          "id": "brochure",
          "name": "brochure",
          "kind": "asset",
          "presence": "maybe",
          "required": false,
          "localized": false,
          "sortable": false,
          "many": false,
          "accept": [
            "application/pdf"
          ]
        },
        {
          "id": "attachments",
          "name": "attachments",
          "kind": "asset",
          "presence": "maybe",
          "required": false,
          "localized": false,
          "sortable": false,
          "many": true,
          "accept": []
        },
        {
          "id": "rating",
          "name": "rating",
          "kind": "number",
          "presence": "maybe",
          "required": false,
          "localized": false,
          "sortable": true
        },
        {
          "id": "meta",
          "name": "meta",
          "kind": "json",
          "presence": "maybe",
          "required": false,
          "localized": false,
          "sortable": false
        },
        {
          "id": "sections",
          "name": "sections",
          "kind": "repeater",
          "presence": "maybe",
          "required": false,
          "localized": false,
          "sortable": false,
          "of": []
        }
      ]
    }
  },
  "components": {},
  "warnings": [
    {
      "type": "page",
      "field": "sections",
      "message": "holds component type 'heroBlock', which is not on this ref"
    },
    {
      "type": "page",
      "field": "sections",
      "message": "holds component type 'quoteBlock', which is not on this ref"
    }
  ]
}
